"SOURCE ID: Author/Org, Date, Info",Link,World / Drawdown Region,Specific Geographic Location,Source Validation Code,Year / Date,License Code,Raw Data Input,Original Units,Conversion calculation,Common Units,Weight,Assumptions,Exclude Data?
"Balaras et al (2007) (Greece HPS window adoption) - Balaras, Constantinos A., Athina G. Gaglia, Elena Georgopoulou, Sevastianos Mirasgedis, Yiannis Sarafidis, and Dimitris P. Lalas. “European Residential Buildings and Empirical Assessment of the Hellenic Building Stock, Energy Consumption, Emissions and Potential Energy Savings.” Building and Environment 42, no. 3 (March 2007): 1298–1314. https://doi.org/10.1016/j.buildenv.2005.11.001.",https://linkinghub.elsevier.com/retrieve/pii/S0360132305004671,World,Greece,1  - Peer Reviewed,2018,,0.4036411320077015,,10692.431327353124,million sq-meters,,Data from Specified country applied to whole world,True
"EIA (2012) (USA Double and Triple Adoption in Commercial Market) - U.S. Department of Energy. “Commercial Energy Consumption Survey (CBECS) - Energy Information Administration,” 2017. https://www.eia.gov/consumption/residential/.",https://www.eia.gov/consumption/residential/,World,USA,2 - Public Sector/ Multilateral Agency,2018,,0.5879864636209814,,15575.72899572733,million sq-meters,,Data from Specified country applied to whole world,True
"Ducker (2010) (Commercial estimate reference in ARPA-E report) - Selkowitz, Stephen. “Single Pane Windows: Dinosaurs in a Sustainable World?” presented at the ARPA-E, November 6, 2014. https://arpa-e.energy.gov/sites/default/files/03%20-%20Selkowitz%20-%20ARPA%20E_selk_final.pdf.",https://arpa-e.energy.gov/sites/default/files/03%20-%20Selkowitz%20-%20ARPA%20E_selk_final.pdf,World,USA,3 - For Profit,2018,,0.55,,14569.469669240774,million sq-meters,,Data from Specified country applied to whole world,True
"Petermann et al (2010) Transparency for China’s Windows through Energy Labeling, ACEEE Summer Study on Energy Efficiency in Buildings, 163-174",https://www.aceee.org/files/proceedings/2010/data/papers/2112.pdf,World,China,1  - Peer Reviewed,2010,,0.1,New Windows are Low-e,2648.9944853165043,million sq-meters,,"Assumed that half of this value is the current adoption, and that figures apply to current year.",
"Shukla et al (2015) Residential buildings in India: Energy use projections and savings potentials, Proceedings of the European Council for an Energy Efficienct Economy (ECEEE) Summer Study Conference",https://www.eceee.org/library/conference_proceedings/eceee_Summer_Studies/2015/6-policies-and-programmes-towards-a-zero-energy-building-stock/residential-buildings-in-india-energy-use-projections-and-savings-potentials/,World,India,1  - Peer Reviewed,2015,,<5%,,662.2486213291261,million sq-meters,,"Since the BAU Scenario is assumed to have Windows with u-values equivalent to Single pane glass (5.8 W/m2K), and the Moderate Scenario is expecting a 5% penetration of more efficient envelopes (ECBC), it's safe to assume that the current adoption in India is close to 0%. 2.5% assumed in current year.",
