"SOURCE ID: Author/Org, Date, Info",Link,World / Drawdown Region,Specific Geographic Location,Thermal-Moisture Regime,Source Validation Code,Year / Date,License Code,Raw Data Input,Original Units,Conversion calculation,Common Units,Weight,Assumptions,Exclude Data?
"Nair 2012; lit review reporting BGB, min value of range; Nair, P.K., “Climate change mitigation: A low-hanging fruit of agroforestry” in Agroforestry: The Future of Global Land Use, p. 31-67. Amsterdam: Springer, 2012.",https://link.springer.com/chapter/10.1007/978-94-007-4676-3_7,World,global humid tropics,Tropical-Humid,1  - Peer Reviewed,2012,,100.0,kg C/ha/yr,0.1,t C/ha/yr,,"lit review; multistrata systems; below-ground biomass; min value of range; refer Table 3, p. 53",
"Nair 2012; lit review reporting BGB, max value of range; Nair, P.K., “Climate change mitigation: A low-hanging fruit of agroforestry” in Agroforestry: The Future of Global Land Use, p. 31-67. Amsterdam: Springer, 2012.",https://link.springer.com/chapter/10.1007/978-94-007-4676-3_7,World,global humid tropics,Tropical-Humid,1  - Peer Reviewed,2012,,2.0,kg C/ha/yr,0.002,t C/ha/yr,,"lit review; multistrata systems; below-ground biomass; max value of range; refer Table 3, p. 53",
"Kim et al. 2016; lit review reported for homegarden systems, BGB, min value of range; Kim, Dong-Gill, Miko UF Kirschbaum, and Tracy L. Beedy. ""Carbon sequestration and net emissions of CH4 and N2O under agroforestry: Synthesizing available data and suggestions for future studies."" Agriculture, Ecosystems & Environment 226 (2016): 65-78.",https://www.sciencedirect.com/science/article/pii/S0167880916302122,World,global humid tropics,Tropical-Humid,1  - Peer Reviewed,2016,,1.2,t C/ha/yr,,t C/ha/yr,,"lit review; homegardens; below-ground biomass; min value of range; refer Table 2, p. 70",
"Kim et al. 2016; lit review reported for homegarden systems, BGB, max value of range; Kim, Dong-Gill, Miko UF Kirschbaum, and Tracy L. Beedy. ""Carbon sequestration and net emissions of CH4 and N2O under agroforestry: Synthesizing available data and suggestions for future studies."" Agriculture, Ecosystems & Environment 226 (2016): 65-78.",https://www.sciencedirect.com/science/article/pii/S0167880916302122,World,global humid tropics,Tropical-Humid,1  - Peer Reviewed,2016,,1.7,t C/ha/yr,,t C/ha/yr,,"lit review; homegardens; below-ground biomass; max value of range; refer Table 2, p. 70",
"Kim et al. 2016; lit review reported for shaded systems, BGB, min value of range; Kim, Dong-Gill, Miko UF Kirschbaum, and Tracy L. Beedy. ""Carbon sequestration and net emissions of CH4 and N2O under agroforestry: Synthesizing available data and suggestions for future studies."" Agriculture, Ecosystems & Environment 226 (2016): 65-78.",https://www.sciencedirect.com/science/article/pii/S0167880916302122,World,global humid tropics,Tropical-Humid,1  - Peer Reviewed,2016,,0.2,t C/ha/yr,,t C/ha/yr,,"lit review; shaded systems; below-ground biomass & SOC; min value of range; refer Table 2, p. 70",
"Kim et al. 2016; lit review reported for shaded systems, BGB, max value of range; Kim, Dong-Gill, Miko UF Kirschbaum, and Tracy L. Beedy. ""Carbon sequestration and net emissions of CH4 and N2O under agroforestry: Synthesizing available data and suggestions for future studies."" Agriculture, Ecosystems & Environment 226 (2016): 65-78.",https://www.sciencedirect.com/science/article/pii/S0167880916302122,World,global humid tropics,Tropical-Humid,1  - Peer Reviewed,2016,,1.0,t C/ha/yr,,t C/ha/yr,,"lit review; shaded systems; below-ground biomass & SOC; max value of range; refer Table 2, p. 70",
