"SOURCE ID: Author/Org, Date, Info",Link,World / Drawdown Region,Specific Geographic Location,Source Validation Code,Year / Date,License Code,Raw Data Input,Original Units,Conversion calculation,Common Units,Weight,Assumptions,Exclude Data?
IPCC Renewable Energy Sources and Climate Change Mitigation Summary for Policymakers and Technical Summary pg 82,https://www.ipcc.ch/pdf/special-reports/srren/SRREN_FD_SPM_final.pdf,World,,1  - Peer Reviewed,2011,,,years,0.0,TWh/TW,,,
IPCC Renewable Energy Sources and Climate Change Mitigation Summary for Policymakers and Technical Summary pg 82,https://www.ipcc.ch/pdf/special-reports/srren/SRREN_FD_SPM_final.pdf,World,,1  - Peer Reviewed,2011,,,years,0.0,TWh/TW,,,
Instream Energy Systems System Specification Sheet pg 2,http://instreamenergy.com/wp-content/uploads/25kW-Instream-Turbine-Technical-Specifications.pdf,USA,,3 - For Profit,2015,,,years,0.0,TWh/TW,,,
"Kusakana 2008: Economic and Environmental Analysis of Micro Hydropower System for Rural Power Supply, pg 443",https://www.researchgate.net/profile/Kanzumba_Kusakana/publication/224375923_Economic_and_Environmental_Analysis_of_Micro_Hydropower_System_for_Rural_Power_Supply/links/55dc4fb308aec156b9b07e1b.pdf,Middle East and Africa,South Africa,1  - Peer Reviewed,2008,,,years,0.0,TWh/TW,,,
"Paish 2002: Small hydro power: technology and current status, pg 538",http://www.sciencedirect.com/science/article/pii/S1364032102000060,OECD90,UK,1  - Peer Reviewed,2002,,,years,0.0,TWh/TW,,,
IRENA Renewable Energy Technologies Cost Analysis Series pg 7,http://www.irena.org/documentdownloads/publications/re_technologies_cost_analysis-hydropower.pdf,World,,2 - Public Sector/ Multilateral Agency,2012,,,years,0.0,TWh/TW,,,
IRENA Renewable Energy Technologies Cost Analysis Series pg 24,http://www.irena.org/documentdownloads/publications/re_technologies_cost_analysis-hydropower.pdf,World,,2 - Public Sector/ Multilateral Agency,2012,,,years,0.0,TWh/TW,,,
JRC ETRI (2014) HydroPower less than 10 MW (Table 13) reference,http://publications.jrc.ec.europa.eu/repository/handle/JRC92496,EU,,2 - Public Sector/ Multilateral Agency,2014,,,years,0.0,TWh/TW,,,
JRC ETRI (2014) HydroPower Run of River (Table 14) Reference,http://publications.jrc.ec.europa.eu/repository/handle/JRC92496,EU,,2 - Public Sector/ Multilateral Agency,2014,,,years,0.0,TWh/TW,,,
