"SOURCE ID: Author/Org, Date, Info",Link,World / Drawdown Region,Specific Geographic Location,Source Validation Code,Year / Date,License Code,Raw Data Input,Original Units,Conversion calculation,Common Units,Weight,Assumptions,Exclude Data?
McCarthy et a. 2011,http://www.fao.org/climatechange/29765-08b92911662298c69c61a88337c72a578.pdf,Middle East & Africa,South Africa,2 - Public Sector/ Multilateral Agency,2011,,,USD 2011/ha,0.0,US$2014/ ha,, Refer table 6; (cited in); Rotational grazing,
World Bank 2011,https://openknowledge.worldbank.org/handle/10986/2751,Middle East & Africa,Mali,2 - Public Sector/ Multilateral Agency,2005,,,USD 2005/ha,0.0,US$2014/ ha,,Calculation used to derive the input value is not clear; Rotational grazing - cost of enclosures,
Chesapeake Bay Federal Assessment Scenario Tool,http://www.bayfast.org/Documentation.aspx,OECD90,United States - Virginia,2 - Public Sector/ Multilateral Agency,2015,,,USD 2014/ha,0.0,US$2014/ ha,,Source not available; Prescribed grazing,
Undersander et al. 1997,http://www.nrcs.usda.gov/Internet/FSE_DOCUMENTS/stelprdb1097378.pdf,OECD90,United States,2 - Public Sector/ Multilateral Agency,1997,,,USD 1997/acre,0.0,US$2014/ ha,,"Refer page 2 last para; Rotational grazing - setting up whole system using new fencing, fencers, and water systems (low-end of estimated range)",
Undersander et al. 1997,http://www.nrcs.usda.gov/Internet/FSE_DOCUMENTS/stelprdb1097378.pdf,OECD90,United States,2 - Public Sector/ Multilateral Agency,1997,,,USD 1997/acre,0.0,US$2014/ ha,,"Refer page 2 last para; Rotational grazing - setting up whole system using new fencing, fencers, and water systems (high end of estimated range, includes cost of constructing some livestock lanes)",
