"SOURCE ID: Author/Org, Date, Info",Link,World / Drawdown Region,Specific Geographic Location,Thermal-Moisture Regime,Source Validation Code,Year / Date,License Code,Raw Data Input,Original Units,Conversion calculation,Common Units,Weight,Assumptions,Exclude Data?
"Cordero and Boshier (ed) 2003; peach palm, average operating costs in Costa Rica; Cordero & Boshier, ed. Árboles de Centroamérica: un manual para extensionistas. Bib. Orton IICA/CATIE, 2003.",https://www.catie.ac.cr/catie-noticias/759-libro-arboles-de-centroamerica-ahora-en-version-digital.html,Latin America,Costa Rica,Tropical-Humid,2 - Public Sector/ Multilateral Agency,2003,,800.0,USD/ha/yr,1032.0,US$2014/ ha/ yr,,"peach palm; operating cost, p. 386 (in-text) - as the year was not mentioned, so the data was divided by the average lifespan of a banana tree, i.e, ~5 years",
"Cordero and Boshier (ed) 2003; cashew, average operating costs in El Salvador; Cordero & Boshier, ed. Árboles de Centroamérica: un manual para extensionistas. Bib. Orton IICA/CATIE, 2003.",https://www.catie.ac.cr/catie-noticias/759-libro-arboles-de-centroamerica-ahora-en-version-digital.html,Latin America,El Salvador,Tropical-Humid,2 - Public Sector/ Multilateral Agency,2003,,2100.0,Colones ,311.3793103448276,US$2014/ ha/ yr,,cashew; p. 353 in-text (@8.7/2003 dollar https://en.wikipedia.org/wiki/Tables_of_historical_exchange_rates_to_the_United_States_dollar) ,
Race et al,http://csusap.csu.edu.au/~acurtis/papers/racecurtisbooth_1999.pdf,OECD90,Australia,Tropical-Semi-Arid,1  - Peer Reviewed,1999,,3989.0,Australian dollars/ha/yr,4078.305970149254,US$2014/ ha/ yr,,"carob (Table 1 sum of total annual operating cost excluding overhead cost, @20.8 t/ha/yr)/ (@1.34 https://en.wikipedia.org/wiki/Tables_of_historical_exchange_rates_to_the_United_States_dollar) ",
"Rural Agricultural Development Authority (RADA) of Jamaica; breadfruit system, average maintenance cost over 5 years in Jamainca; Rural Agricultural Development Authority (RADA) “Marketing & Business Profile: Bread Fruit (Artocarpus altilis)” Jamaican Ministry of Agriculture & Lands (2013). https://www.rada.gov.jm/publications/publications/post-harvest-marketing/item/501-marketing-business-profile-bread-fruit-artocarpus-altilis",https://www.rada.gov.jm/publications/publications/post-harvest-marketing/item/501-marketing-business-profile-bread-fruit-artocarpus-altilis,Latin America,Jamaica,Tropical-Humid,2 - Public Sector/ Multilateral Agency,2013,,66000.0,Jamaican dollars ,628.0368420439627,US$2014/ ha/ yr,,"breadfruit - establish and maintenance cost over 5 years, therefore the establishment cost (low estimate used in order to take conservative approach) based on the meta-analysis was subtracted / (@72.23 https://en.wikipedia.org/wiki/Tables_of_historical_exchange_rates_to_the_United_States_dollar)",
"Ebiowei 2013; banana system in Nigeria, total variable cost; Ebiowei, KAINGA Prince. ""Budgetary analysis of banana (Musa sapientum L.) and Plantain (Musa paradisiaca L.) production."" Journal of Agricultural and Crop Research 1.4 (2013): 55-60.",http://sciencewebpublishing.net/jacr/archive/2013/October/pdf/Ebiowei.pdf,Middle East and Africa,Nigeria,Tropical-Humid,1  - Peer Reviewed,2013,,269631.72,Nigerian naira ,431.5461390240075,US$2014/ ha/ yr,,"plantain; total variable cost (as the year was not mentioned, so the data was divided by the average lifespan of a banana tree, i.e, ~5 years), see Table 2 p. 59 (@ 127.46  https://en.wikipedia.org/wiki/Tables_of_historical_exchange_rates_to_the_United_States_dollar)",
"Ebiowei 2013; plantain system in Nigeria, total variable cost; Ebiowei, KAINGA Prince. ""Budgetary analysis of banana (Musa sapientum L.) and Plantain (Musa paradisiaca L.) production."" Journal of Agricultural and Crop Research 1.4 (2013): 55-60.",http://sciencewebpublishing.net/jacr/archive/2013/October/pdf/Ebiowei.pdf,Middle East and Africa,Nigeria,Tropical-Humid,2  - Peer Reviewed,2013,,291246.1,Nigerian naira ,466.14,US$2014/ ha/ yr,,"banana; total variable cost (as the year was not mentioned, so the data was divided by the average lifespan of a banana tree, i.e, ~5 years), see Table 1 p. 58 (@ 127.46  https://en.wikipedia.org/wiki/Tables_of_historical_exchange_rates_to_the_United_States_dollar) ",
Phillip 2009,http://citeseerx.ist.psu.edu/viewdoc/download?doi=10.1.1.415.2371&rep=rep1&type=pdf,Middle East and Africa,Nigeria,Tropical-Humid,1  - Peer Reviewed,2009,,126528.22,Nigerian naira/ha/2yr,963.4573030596705,US$2014/ ha/ yr,,"plantain, table 1  / (@ 117.8 https://en.wikipedia.org/wiki/Tables_of_historical_exchange_rates_to_the_United_States_dollar) - ",
Onoh 2015,https://www.semanticscholar.org/paper/Economics-of-Cashew-Harvesting-and-Marketing-in-Onoh-Udah/e8e791a4532a3153b8f3556c608185e4e555ff30,Middle East and Africa,Nigeria,Tropical-Humid,1  - Peer Reviewed,2015,,67103.0,Nigerian naira ,568.9571089134125,US$2014/ ha/ yr,,cashew (Table 5) / (@ 117.8 https://en.wikipedia.org/wiki/Tables_of_historical_exchange_rates_to_the_United_States_dollar),
"Chew et al 1999; sago palm plantation annual average in Malaysia; Chew, et al. “The sago industry in Malaysia: present status and future prospects”. Proceedings of the 7th International Working Group on Stored-product Protection – Volume 2. 14-19 October 1998, Beijing China. Sichuan Publishing House of Science and Technology, Chengdu, China, 1999.",http://spiru.cgahr.ksu.edu/proj/iwcspp/pdf2/7/1720.pdf,Asia (Sans Japan),Malaysia,Tropical-Humid,1  - Peer Reviewed,1999,,254.64,RM 1996/ha/yr,964.4489999999998,US$2014/ ha/ yr,,"sago palm (p. 1721), mean annual cost of maintenance. The mean cost of maintenance IS only RM 254.64 (US $ 1.00 = RM 2.50, at the time of our survey) per ha per year. 1996 to 2014 USD inflation rate is 1.515",
"Elbehri et al 2016; FAO publication, banana system, small farm production cost in Ecuador; Elbehri, A., et al. ""Ecuador's banana sector under climate change: an economic and biophysical assessment to promote a sustainable and climate-compatible strategy."" (2016).",http://www.fao.org/3/a-i5697e.pdf,Latin America,Ecuador,Tropical-Humid,2 - Public Sector/ Multilateral Agency,2014,,6853.7,USD/ha/yr,1309.9428273593671,US$2014/ ha/ yr,,"banana; small farm total production cost, therefore the establishment cost (low estimate used in order to take conservative approach) based on the meta-analysis was subtracted; see Table 5 p. 24 (currency not specified, assuming it's USD) - as the year was not mentioned, so the data was divided by the average lifespan of a banana tree, i.e, ~5 years",
"Elbehri et al 2016; FAO publication, banana system, medium-size farm production cost in Ecuador; Elbehri, A., et al. ""Ecuador's banana sector under climate change: an economic and biophysical assessment to promote a sustainable and climate-compatible strategy."" (2016).",http://www.fao.org/3/a-i5697e.pdf,Latin America,Ecuador,Tropical-Humid,2 - Public Sector/ Multilateral Agency,2014,,7742.6,USD/ha/yr,1487.722827359367,US$2014/ ha/ yr,,"banana; medium farm total production cost, therefore the establishment cost (low estimate used in order to take conservative approach) based on the meta-analysis was subtracted; see Table 5 p. 24 (currency not specified, assuming it's USD) - as the year was not mentioned, so the data was divided by the average lifespan of a banana tree, i.e, ~5 years",
"Elbehri et al 2016; FAO publication, banana system, large farm production cost in Ecuador; Elbehri, A., et al. ""Ecuador's banana sector under climate change: an economic and biophysical assessment to promote a sustainable and climate-compatible strategy."" (2016).",http://www.fao.org/3/a-i5697e.pdf,Latin America,Ecuador,Tropical-Humid,2 - Public Sector/ Multilateral Agency,2014,,8981.7,USD/ha/yr,1735.5428273593673,US$2014/ ha/ yr,,"banana; large farm total production cost, therefore the establishment cost (low estimate used in order to take conservative approach) based on the meta-analysis was subtracted; see Table 5 p. 24 (currency not specified, assuming it's USD) - as the year was not mentioned, so the data was divided by the average lifespan of a banana tree, i.e, ~5 years",
"Loganathan et al. 2016; cashew, sample farm in Cuddalore district in India; Loganathan, R., et al. ""Cost, returns and economic viability of cashew plantations in Tamil Nadu."" International Research Journal of Agricultural Economics and Statistics 7.1 (2016): 76-85.",http://www.researchjournal.co.in/upload/assignments/7_76-85.pdf,India,Tamil Nadu,Tropical-Humid,1  - Peer Reviewed,2016,,5574.75,Rs/ha/yr,125.56804610854212,US$2014/ ha/ yr,,cashew; operational cost (average from years 2-9); see Table 2 p. 80 (converted from Rs based on https://en.wikipedia.org/wiki/Tables_of_historical_exchange_rates_to_the_United_States_dollar),
"Loganathan et al. 2016; cashew, sample farm in Ariyalur district in India; Loganathan, R., et al. ""Cost, returns and economic viability of cashew plantations in Tamil Nadu."" International Research Journal of Agricultural Economics and Statistics 7.1 (2016): 76-85.",http://www.researchjournal.co.in/upload/assignments/7_76-85.pdf,India,Tamil Nadu,Tropical-Humid,1  - Peer Reviewed,2016,,5956.875,Rs/ha/yr,134.17519254905096,US$2014/ ha/ yr,,cashew; operational cost (average from years 2-9); see Table 3 p. 81 (converted from Rs based on https://en.wikipedia.org/wiki/Tables_of_historical_exchange_rates_to_the_United_States_dollar),
"Loganathan et al. 2016; cashew, sample farm in Pudukkottai district in India; Loganathan, R., et al. ""Cost, returns and economic viability of cashew plantations in Tamil Nadu."" International Research Journal of Agricultural Economics and Statistics 7.1 (2016): 76-85.",http://www.researchjournal.co.in/upload/assignments/7_76-85.pdf,India,Tamil Nadu,Tropical-Humid,1  - Peer Reviewed,2016,,5658.25,Rs/ha/yr,127.4488357134685,US$2014/ ha/ yr,,cashew; operational cost (average from years 2-9); see Table 4 p. 81 (converted from Rs based on https://en.wikipedia.org/wiki/Tables_of_historical_exchange_rates_to_the_United_States_dollar),
"Hidayat et al 2016; smallholder palm oil in Indonesia, certified scheme; Hidayat, Nia Kurniawati, Astrid Offermans, and Pieter Glasbergen. ""On the profitability of sustainability certification: An analysis among Indonesian palm oil smallholders."" Journal of economics and sustainable development 7.18 (2016): 45-62.",https://www.researchgate.net/profile/Pieter_Glasbergen/publication/308875156_On_The_Profitability_of_Sustainability_Certification_An_Analysis_among_Indonesian_Palm_Oil_Smallholders/links/57f3e00108ae8da3ce5379f3.pdf,Asia (Sans Japan),Indonesia,Tropical-Humid,1  - Peer Reviewed,2016,,1390.34,US$/ha,1372.105994780767,US$2014/ ha/ yr,,"smallholder palm oil; certified independent; operating costs (annual value); see Table 3, p. 53, ",
"Hidayat et al 2016; smallholder palm oil in Indonesia, certified independent; Hidayat, Nia Kurniawati, Astrid Offermans, and Pieter Glasbergen. ""On the profitability of sustainability certification: An analysis among Indonesian palm oil smallholders."" Journal of economics and sustainable development 7.18 (2016): 45-62.",https://www.researchgate.net/profile/Pieter_Glasbergen/publication/308875156_On_The_Profitability_of_Sustainability_Certification_An_Analysis_among_Indonesian_Palm_Oil_Smallholders/links/57f3e00108ae8da3ce5379f3.pdf,Asia (Sans Japan),Indonesia,Tropical-Humid,1  - Peer Reviewed,2016,,1439.04,US$/ha,1420.1673049249214,US$2014/ ha/ yr,,"smallholder palm oil; certified scheme; operating costs (annual value); see Table 3, p. 53, ",
Economics and Marketing of Cashew Cultivation,https://shodhganga.inflibnet.ac.in/bitstream/10603/34968/14/14_chapter_06.pdf,Asia (Sans Japan),India,,2 - Public Sector/ Multilateral Agency,2010,,18802.0,Rs/ha/yr,467.754142511526,US$2014/ ha/ yr,,"Refer table 6.3, recurring cost",
Economics and Marketing of Cashew Cultivation,https://shodhganga.inflibnet.ac.in/bitstream/10603/34968/14/14_chapter_06.pdf,Asia (Sans Japan),India,,2 - Public Sector/ Multilateral Agency,2010,,17891.0,Rs/ha/yr,445.0903820696581,US$2014/ ha/ yr,,"Refer table 6.4, recurring cost",
"Govindasamy, R. (2018). A Study on Production of Coconut in Coimbatore District, Tamilnadu. Shanlax International Journal of Economics, 7(1), 27-35.",https://ideas.repec.org/a/acg/journl/v7y2018i1p27-35.html,Asia (Sans Japan),India,,1  - Peer Reviewed,2018,,27591.89,Rs/acre/6 yr,244.76037029239228,US$2014/ ha/ yr,,"Refer table on page 33-34, 2018 to 2014 usd inflation rate - 0.943715783",
