"SOURCE ID: Author/Org, Date, Info",Link,World / Drawdown Region,Specific Geographic Location,Thermal-Moisture Regime,Source Validation Code,Year / Date,License Code,Raw Data Input,Original Units,Conversion calculation,Common Units,Weight,Assumptions,Exclude Data?
Hayward and Graham (2013). - CSP,http://www.sciencedirect.com/science/article/pii/S0140988313001837,World,,,1  - Peer Reviewed,2013,,0.146,%,,%,,,
"Platzer (2016). Min range of learning rates for CSP.Platzer, W. J. et al (2016). A learning curve for solar thermal power. AIP Conference Proceedings 1734, 160013 (2016). American Institute of Physics. doi: doi: 10.1063/1.4949254",https://aip.scitation.org/doi/pdf/10.1063/1.4949254?class=pdf,World,,,4 - Independently Verified,2016,,0.15,%,,%,,Min range for complete capital cost,
"Platzer (2016). Max range of learning rates for CSP.Platzer, W. J. et al. (2016). A learning curve for solar thermal power. AIP Conference Proceedings 1734, 160013 (2016). American Institute of Physics. doi: doi: 10.1063/1.4949254",https://aip.scitation.org/doi/pdf/10.1063/1.4949254?class=pdf,World,,,4 - Independently Verified,2016,,0.2,%,,%,,Max range for complete capital cost,
"Boretti (2017). Actual learning rates of US CSP plants over last five years.Boretti A., et al.. (2017, November 17). Concentrating Solar Power Tower: Latest Status Report and Survey of Development Trends. doi:doi:10.20944/preprints201710.0027.v2",https://www.preprints.org/manuscript/201710.0027/v2/download,World,,,4 - Independently Verified,2017,,0.2,%,,%,,,
"Lilliestam (2017). Min learning rate over 2008-2011. Lilliestam, J. et al. (2017). Empirically observed learning rates for concentrating solar power and their responses to regime change. Nature Energy, Vol 2: 17094.",http://adsabs.harvard.edu/abs/2017NatEn...217094L,World,,,1  - Peer Reviewed,2017,,0.2,%,,%,,Min for CSP plants over 2008-2011.,
"Pitz-Paal (2017). Minimum global learning rates over past five years. Pitz-Paal, R. (2017). Concentrating solar power: Still small but learning fast. Nature Energy. Vol 2 - 17095; http://dx.doi.org/10.1038/nenergy.2017.95",https://www.nature.com/articles/nenergy201795.epdf?author_access_token=E5KgucY47J3IVdv2iSJIINRgN0jAjWel9jnR3ZoTv0NpXgua_Xzgbl-81-EZAvHG2TpF4F0-7D8nOPNXrs0-_e-3cxeC6-WVVM870LtvVGq9BdtdD5WCo3IqkwExmgB8OFdixjCh5nJPs8HAI5IZBg==,World,,,1  - Peer Reviewed,2017,,0.25,%,,%,,Min Global learning rate over past five years,
IRENA (2018).Pre-2013 Learning rates CSP plants.IRENA. (2018b). Power Generation Costs in 2017. Abu Dhabi: IRENA.p-83,http://www.solarpaces.org/wp-content/uploads/IRENA_2017_Power_Costs_2018.pdf,World,,,2 - Public Sector/ Multilateral Agency,2018,,0.12,%,,%,,Pre-2013 Learning rates CSP plants,
IRENA (2018).Post-2013 Learning rates CSP plants.IRENA. (2018b). Power Generation Costs in 2017. Abu Dhabi: IRENA.p-83,http://www.solarpaces.org/wp-content/uploads/IRENA_2017_Power_Costs_2018.pdf,World,,,2 - Public Sector/ Multilateral Agency,2018,,0.2,%,,%,,Post-2013 Learning rates CSP plants,
IRENA (2018).Current Learning rates CSP plants.IRENA. (2018b). Power Generation Costs in 2017. Abu Dhabi: IRENA.p-83,http://www.solarpaces.org/wp-content/uploads/IRENA_2017_Power_Costs_2018.pdf,World,,,2 - Public Sector/ Multilateral Agency,2018,,0.3,%,,%,,Current Learning rates CSP plants,
